question,answer
How can I search for a specific book?,"You can search for books by title, author, ISBN, or keywords. Simply type the book name or author in the search box, and I'll help you find it."
Can you recommend books in a specific genre?,"Absolutely! I can recommend books in various genres including fiction, mystery, romance, science fiction, biography, self-help, and more. Just tell me what genre interests you."
What are the bestselling books right now?,Our current bestsellers include titles across fiction and non-fiction. I can show you the top books in specific categories or overall bestsellers. Which would you prefer?
Do you have books by [author name]?,"Let me check our catalog for books by that author. Please provide the author's name, and I'll show you all available titles."
Can you suggest books similar to [book title]?,"Of course! I can recommend books with similar themes, writing styles, or genres. Tell me which book you enjoyed, and I'll find similar reads for you."
Is this book in stock?,"I can check the availability of any book for you. Please provide the book title or ISBN, and I'll let you know if it's currently in stock."
What is the price of [book title]?,"I can look up the price for you. Please share the book title, and I'll provide the current pricing including any discounts available."
Do you offer discounts on bulk purchases?,"Yes! We offer discounts on bulk orders. The discount percentage varies based on quantity. For orders of 10 or more books, please contact our sales team for a custom quote."
Are there any ongoing sales or promotions?,"We regularly have promotions and sales! Current offers include seasonal discounts, bundle deals, and special prices on selected titles. Would you like to know about specific categories?"
Is this book available in ebook format?,"Many of our books are available in multiple formats including paperback, hardcover, and ebook. Let me know which title you're interested in, and I'll check the available formats."
Do you have audiobooks?,"Yes, we offer audiobooks for many popular titles. I can check if a specific book is available in audio format. Which title are you interested in?"
What's the difference between hardcover and paperback?,"Hardcover books have rigid protective covers and are more durable, making them ideal for collectors. Paperback books have flexible covers, are lighter, and typically less expensive. Both contain the same content."
Do you sell used or second-hand books?,"Currently, we focus on new books. However, we occasionally have special collections of gently used books at discounted prices. Would you like me to notify you when they're available?"
How do I place an order?,"Placing an order is easy! Browse or search for your desired book, add it to your cart, and proceed to checkout. You'll need to provide shipping information and payment details to complete your order."
What payment methods do you accept?,"We accept major credit cards (Visa, MasterCard, American Express), debit cards, PayPal, and digital wallets like Apple Pay and Google Pay."
How long does shipping take?,Standard shipping typically takes 5-7 business days. Express shipping is available for 2-3 business days delivery. International orders may take 10-15 business days depending on the destination.
Do you ship internationally?,"Yes, we ship to most countries worldwide. Shipping costs and delivery times vary by location. Please provide your country during checkout for accurate shipping information."
What are the shipping costs?,Shipping costs depend on your location and the shipping method chosen. Standard shipping starts at $4.99 for domestic orders. Free shipping is available on orders over $35.
Can I track my order?,"Yes! Once your order ships, you'll receive a tracking number via email. You can use this number to track your package's delivery status in real-time."
What is your return policy?,We accept returns within 30 days of purchase for a full refund. Books must be in original condition with no markings or damage. Please contact customer service to initiate a return.
Can I exchange a book?,"Yes, we offer exchanges for defective or damaged books. If you received the wrong item or it arrived damaged, please contact us within 7 days of delivery for a free exchange."
How do I return a book?,"To return a book, contact our customer service team with your order number. We'll provide a return shipping label and instructions. Once we receive the book, your refund will be processed within 5-7 business days."
What if my book arrives damaged?,"We apologize for any damage! Please contact us immediately with photos of the damaged item. We'll send a replacement at no charge or process a full refund, whichever you prefer."
Do I need an account to purchase books?,"You can checkout as a guest, but creating an account offers benefits like order tracking, saved addresses, wish lists, and personalized recommendations."
How do I create an account?,"Click on 'Sign Up' at the top of the page, provide your email address, create a password, and fill in your basic information. You'll receive a confirmation email to activate your account."
I forgot my password. How can I reset it?,"Click on 'Forgot Password' on the login page, enter your email address, and we'll send you a password reset link. Follow the instructions in the email to create a new password."
How can I contact customer service?,"You can reach our customer service team via email at support@bookstore.com, call us at 1-800-BOOKS-99, or use the live chat feature on our website. We're available Monday-Friday, 9 AM to 6 PM."
Can I cancel my order?,Orders can be cancelled within 24 hours of placement if they haven't shipped yet. Please contact customer service immediately with your order number to request cancellation.
What information do you provide about each book?,"For each book, we provide the title, author, publisher, publication date, ISBN, page count, book description, customer reviews, and ratings. Some books also include sample chapters."
Can I read reviews before buying?,Absolutely! Each book page includes customer reviews and ratings to help you make an informed decision. You can also write your own review after purchasing.
Do you have book summaries?,"Yes, each book listing includes a detailed description or summary. This gives you an overview of the plot, themes, and what to expect from the book."
What does the star rating mean?,"Our star rating system ranges from 1 to 5 stars. Five stars indicates excellent quality, while one star suggests the book didn't meet reader expectations. Ratings are based on customer reviews."
Do you offer gift wrapping?,Yes! We offer gift wrapping services for a small additional fee. You can select this option during checkout and even include a personalized message.
Can I pre-order upcoming books?,Absolutely! Many upcoming releases are available for pre-order. Pre-order now and we'll ship your book as soon as it's released. You'll also get the best price guarantee.
Do you have a wishlist feature?,Yes! Create an account and you can save books to your wishlist for future purchase. You can also share your wishlist with friends and family.
Are there book clubs or reading groups?,"We host virtual book clubs and reading groups! Check our Events page for upcoming discussions, author Q&As, and reading challenges. Everyone is welcome to join."
Do you offer gift cards?,"Yes, we offer digital and physical gift cards in various denominations. They make perfect gifts for book lovers and never expire."
What genres do you carry?,"We carry a wide range of genres including Fiction, Non-Fiction, Mystery, Thriller, Romance, Science Fiction, Fantasy, Biography, Self-Help, History, Business, Children's Books, Young Adult, and more."
Do you have children's books?,"Yes! We have an extensive children's book section with titles for all ages, from board books for babies to chapter books for middle-grade readers. I can help you find age-appropriate books."
What are your most popular categories?,"Our most popular categories include Contemporary Fiction, Mystery & Thriller, Self-Help & Personal Development, Biography & Memoir, and Young Adult Fiction. Would you like recommendations from any of these?"
The website isn't working properly. What should I do?,"Try clearing your browser cache and cookies, or use a different browser. If the issue persists, please contact our technical support team at support@bookstore.com with details about the problem."
I can't find a book I'm looking for,"If you can't find a specific book, it might be out of stock or not yet in our catalog. Please provide the title and author, and I can check availability or suggest similar titles."
How do I apply a discount code?,"During checkout, you'll see a field labeled 'Discount Code' or 'Promo Code'. Enter your code there and click 'Apply'. The discount will be reflected in your order total."
